{"$schema":"https://json-schema.org/draft/2020-12/schema","additionalProperties":false,"properties":{"activated_at":{"pattern":"^[0-9]{4}-[0-9]{2}-[0-9]{2}T[0-9]{2}:[0-9]{2}:[0-9]{2}Z$","type":"string"},"active_transition_commit":{"pattern":"^[0-9a-f]{40}$","type":"string"},"applied_commit":{"pattern":"^[0-9a-f]{40}$","type":"string"},"audit":{"minLength":1,"type":"string"},"aws_retention_hold":{"minLength":1,"type":"string"},"offen_archives_preserved":{"type":"boolean"},"offen_scheduler":{"minLength":1,"type":"string"},"proton_independent_timer":{"type":"boolean"},"restore_evidence_sha256":{"pattern":"^[0-9a-f]{64}$","type":"string"},"runner_status":{"additionalProperties":false,"properties":{"interruption":{"type":"boolean"},"migration":{"minLength":1,"type":"string"},"pending":{"minimum":0,"type":"integer"},"policy_sha256":{"pattern":"^[0-9a-f]{64}$","type":"string"},"repositories_ready":{"type":"boolean"}},"required":["interruption","migration","pending","policy_sha256","repositories_ready"],"type":"object"},"state":{"minLength":1,"type":"string"},"type":{"minLength":1,"type":"string"},"units":{"additionalProperties":false,"properties":{"home-lab-restic-daily.timer":{"additionalProperties":false,"properties":{"active_state":{"minLength":1,"type":"string"},"next_elapse_utc":{"pattern":"^[0-9]{4}-[0-9]{2}-[0-9]{2}T[0-9]{2}:[0-9]{2}:[0-9]{2}Z$","type":"string"},"persistent":{"type":"boolean"},"unit_file_state":{"minLength":1,"type":"string"}},"required":["active_state","next_elapse_utc","persistent","unit_file_state"],"type":"object"},"home-lab-restic-maintenance.timer":{"additionalProperties":false,"properties":{"active_state":{"minLength":1,"type":"string"},"next_elapse_utc":{"pattern":"^[0-9]{4}-[0-9]{2}-[0-9]{2}T[0-9]{2}:[0-9]{2}:[0-9]{2}Z$","type":"string"},"persistent":{"type":"boolean"},"unit_file_state":{"minLength":1,"type":"string"}},"required":["active_state","next_elapse_utc","persistent","unit_file_state"],"type":"object"},"home-lab-restic-recover.service":{"additionalProperties":false,"properties":{"active_state":{"minLength":1,"type":"string"},"unit_file_state":{"minLength":1,"type":"string"}},"required":["active_state","unit_file_state"],"type":"object"}},"required":["home-lab-restic-daily.timer","home-lab-restic-maintenance.timer","home-lab-restic-recover.service"],"type":"object"},"version":{"minimum":0,"type":"integer"}},"required":["activated_at","active_transition_commit","applied_commit","audit","aws_retention_hold","offen_archives_preserved","offen_scheduler","proton_independent_timer","restore_evidence_sha256","runner_status","state","type","units","version"],"type":"object"}
