{"activated_at":"2026-08-26T14:11:31Z","active_transition_commit":"4c63b8c6bd0fb278e1debb80f3d334f83d9352a6","applied_commit":"2ccc77929b86671502c27108f86ac5520a53e433","audit":"pass","aws_retention_hold":"applied","offen_archives_preserved":true,"offen_scheduler":"quiesced","proton_independent_timer":false,"restore_evidence_sha256":"b68550eb34e3c8b3832ae9ddf64857364b54538a719cc9501620cb3fd0735f0f","runner_status":{"interruption":false,"migration":"active","pending":0,"policy_sha256":"45051846834195c3ea9ebe2b42fb4b48e4952ca91d0da8f46eb5d4306d964be2","repositories_ready":true},"state":"active-verified","type":"restic-schedule-activation","units":{"home-lab-restic-daily.timer":{"active_state":"active","next_elapse_utc":"2026-08-27T05:00:00Z","persistent":false,"unit_file_state":"enabled"},"home-lab-restic-maintenance.timer":{"active_state":"active","next_elapse_utc":"2026-09-01T00:16:27Z","persistent":false,"unit_file_state":"enabled"},"home-lab-restic-recover.service":{"active_state":"inactive","unit_file_state":"enabled"}},"version":1}
